{
  "$schema": "http://json-schema.org/draft-07/schema#",
  "type": "array",
  "items": {
    "type": "object",
    "required": ["title", "url", "type", "cover", "w", "h", "year"],
    "properties": {
      "title": { "type": "string", "minLength": 1 },
      "url": { "type": "string", "format": "uri" },
      "type": { "enum": ["original", "translation"] },
      "cover": { "type": "string", "pattern": "^img/books/.+\\.(webp|jpg|png)$" },
      "w": { "type": "integer", "minimum": 1 },
      "h": { "type": "integer", "minimum": 1 },
      "year": { "type": "integer", "minimum": 1900, "maximum": 2100 }
    },
    "additionalProperties": false
  }
}
