[
  { "title": "OpenClaw 快速上手：极简部署与实战", "url": "https://book.douban.com/subject/38549104/", "type": "original", "cover": "img/books/openclaw.webp", "w": 400, "h": 580, "year": 2026 },
  { "title": "HTML5 与 CSS3 网页设计项目教程", "url": "https://book.douban.com/subject/37533404/", "type": "original", "cover": "img/books/37533404.webp", "w": 373, "h": 531, "year": 2025 },
  { "title": "Node.js 后端全程实战", "url": "https://book.douban.com/subject/36374893/", "type": "original", "cover": "img/books/36374893.webp", "w": 400, "h": 513, "year": 2023 },
  { "title": "Vue.js 全平台前端实战", "url": "https://book.douban.com/subject/35886403/", "type": "original", "cover": "img/books/35886403.webp", "w": 400, "h": 519, "year": 2022 },
  { "title": "JavaScript 全栈开发", "url": "https://book.douban.com/subject/35493728/", "type": "original", "cover": "img/books/35493728.webp", "w": 400, "h": 502, "year": 2021 },
  { "title": "NLTK 基础教程", "url": "https://book.douban.com/subject/27057666/", "type": "translation", "cover": "img/books/27057666.webp", "w": 400, "h": 546, "year": 2020 },
  { "title": "C++ 程序设计", "url": "https://book.douban.com/subject/34711734/", "type": "translation", "cover": "img/books/34711734.webp", "w": 400, "h": 562, "year": 2019 },
  { "title": "Git 学习指南", "url": "https://book.douban.com/subject/26967729/", "type": "translation", "cover": "img/books/26967729.webp", "w": 400, "h": 514, "year": 2019 },
  { "title": "Python 算法教程", "url": "https://book.douban.com/subject/26699412/", "type": "translation", "cover": "img/books/26699412.webp", "w": 400, "h": 503, "year": 2016 },
  { "title": "JavaScript 面向对象编程指南（第 2 版）", "url": "https://book.douban.com/subject/26302623/", "type": "translation", "cover": "img/books/26302623.webp", "w": 400, "h": 503, "year": 2015 },
  { "title": "HTML5 和 CSS3 快速参考", "url": "https://book.douban.com/subject/25730129/", "type": "translation", "cover": "img/books/25730129.webp", "w": 400, "h": 496, "year": 2015 },
  { "title": "元素模式", "url": "https://book.douban.com/subject/25908396/", "type": "translation", "cover": "img/books/25908396.webp", "w": 400, "h": 511, "year": 2014 },
  { "title": "JavaScript 面向对象编程指南", "url": "https://book.douban.com/subject/21372235/", "type": "translation", "cover": "img/books/21372235.webp", "w": 390, "h": 500, "year": 2013 },
  { "title": "Visual C++ 并行编程实战", "url": "https://book.douban.com/subject/11580452/", "type": "translation", "cover": "img/books/11580452.webp", "w": 400, "h": 547, "year": 2012 },
  { "title": "测试驱动的 JavaScript 开发", "url": "https://book.douban.com/subject/10483528/", "type": "translation", "cover": "img/books/10483528.webp", "w": 240, "h": 322, "year": 2012 }
]
